[
	{
		"name": "Turtle",
		"pets": {
			"tier_1_pets": [
				{
					"name": "Duck",
					"url": "https://sapi.com/pets/duck"
				},
				{
					"name": "Beaver",
					"url": "https://sapi.com/pets/beaver"
				},
				{
					"name": "Otter",
					"url": "https://sapi.com/pets/otter"
				},
				{
					"name": "Pig",
					"url": "https://sapi.com/pets/pig"
				},
				{
					"name": "Ant",
					"url": "https://sapi.com/pets/ant"
				},
				{
					"name": "Mosquito",
					"url": "https://sapi.com/pets/mosquito"
				},
				{
					"name": "Mouse",
					"url": "https://sapi.com/pets/mouse"
				},
				{
					"name": "Fish",
					"url": "https://sapi.com/pets/fish"
				},
				{
					"name": "Cricket",
					"url": "https://sapi.com/pets/cricket"
				},
				{
					"name": "Horse",
					"url": "https://sapi.com/pets/horse"
				}
			],
			"tier_2_pets": [
				{
					"name": "Snail",
					"url": "https://sapi.com/pets/snail"
				},
				{
					"name": "Crab",
					"url": "https://sapi.com/pets/crab"
				},
				{
					"name": "Swan",
					"url": "https://sapi.com/pets/swan"
				},
				{
					"name": "Rat",
					"url": "https://sapi.com/pets/rat"
				},
				{
					"name": "Hedgehog",
					"url": "https://sapi.com/pets/hedgehog"
				},
				{
					"name": "Peacock",
					"url": "https://sapi.com/pets/peacock"
				},
				{
					"name": "Flamingo",
					"url": "https://sapi.com/pets/flamingo"
				},
				{
					"name": "Worm",
					"url": "https://sapi.com/pets/worm"
				},
				{
					"name": "Kangaroo",
					"url": "https://sapi.com/pets/kangaroo"
				},
				{
					"name": "Spider",
					"url": "https://sapi.com/pets/spider"
				}
			],
			"tier_3_pets": [
				{
					"name": "Dodo",
					"url": "https://sapi.com/pets/dodo"
				},
				{
					"name": "Badger",
					"url": "https://sapi.com/pets/badger"
				},
				{
					"name": "Dolphin",
					"url": "https://sapi.com/pets/dolphin"
				},
				{
					"name": "Giraffe",
					"url": "https://sapi.com/pets/giraffe"
				},
				{
					"name": "Elephant",
					"url": "https://sapi.com/pets/elephant"
				},
				{
					"name": "Camel",
					"url": "https://sapi.com/pets/camel"
				},
				{
					"name": "Rabbit",
					"url": "https://sapi.com/pets/rabbit"
				},
				{
					"name": "Ox",
					"url": "https://sapi.com/pets/ox"
				},
				{
					"name": "Dog",
					"url": "https://sapi.com/pets/dog"
				},
				{
					"name": "Sheep",
					"url": "https://sapi.com/pets/sheep"
				}
			],
			"tier_4_pets": [
				{
					"name": "Skunk",
					"url": "https://sapi.com/pets/skunk"
				},
				{
					"name": "Hippo",
					"url": "https://sapi.com/pets/hippo"
				},
				{
					"name": "Bison",
					"url": "https://sapi.com/pets/bison"
				},
				{
					"name": "Blowfish",
					"url": "https://sapi.com/pets/blowfish"
				},
				{
					"name": "Turtle",
					"url": "https://sapi.com/pets/turtle"
				},
				{
					"name": "Squirrel",
					"url": "https://sapi.com/pets/squirrel"
				},
				{
					"name": "Penguin",
					"url": "https://sapi.com/pets/penguin"
				},
				{
					"name": "Deer",
					"url": "https://sapi.com/pets/deer"
				},
				{
					"name": "Whale",
					"url": "https://sapi.com/pets/whale"
				},
				{
					"name": "Parrot",
					"url": "https://sapi.com/pets/parrot"
				}
			],
			"tier_5_pets": [
				{
					"name": "Scorpion",
					"url": "https://sapi.com/pets/scorpion"
				},
				{
					"name": "Crocodile",
					"url": "https://sapi.com/pets/crocodile"
				},
				{
					"name": "Rhino",
					"url": "https://sapi.com/pets/rhino"
				},
				{
					"name": "Monkey",
					"url": "https://sapi.com/pets/monkey"
				},
				{
					"name": "Armadillo",
					"url": "https://sapi.com/pets/armadillo"
				},
				{
					"name": "Cow",
					"url": "https://sapi.com/pets/cow"
				},
				{
					"name": "Seal",
					"url": "https://sapi.com/pets/seal"
				},
				{
					"name": "Rooster",
					"url": "https://sapi.com/pets/rooster"
				},
				{
					"name": "Shark",
					"url": "https://sapi.com/pets/shark"
				},
				{
					"name": "Turkey",
					"url": "https://sapi.com/pets/turkey"
				}
			],
			"tier_6_pets": [
				{
					"name": "Leopard",
					"url": "https://sapi.com/pets/leopard"
				},
				{
					"name": "Boar",
					"url": "https://sapi.com/pets/boar"
				},
				{
					"name": "Tiger",
					"url": "https://sapi.com/pets/tiger"
				},
				{
					"name": "Wolverine",
					"url": "https://sapi.com/pets/wolverine"
				},
				{
					"name": "Gorilla",
					"url": "https://sapi.com/pets/gorilla"
				},
				{
					"name": "Dragon",
					"url": "https://sapi.com/pets/dragon"
				},
				{
					"name": "Mammoth",
					"url": "https://sapi.com/pets/mammoth"
				},
				{
					"name": "Cat",
					"url": "https://sapi.com/pets/cat"
				},
				{
					"name": "Snake",
					"url": "https://sapi.com/pets/snake"
				},
				{
					"name": "Fly",
					"url": "https://sapi.com/pets/fly"
				}
			]
		},
		"foods": {
			"tier_1_foods": [
				{
					"name": "Honey",
					"url": "https://sapi.com/foods/honey"
				},
				{
					"name": "Apple",
					"url": "https://sapi.com/foods/apple"
				}
			],
			"tier_2_foods": [
				{
					"name": "Cupcake",
					"url": "https://sapi.com/foods/cupcake"
				},
				{
					"name": "Meat_Bone",
					"url": "https://sapi.com/foods/meat_bone"
				},
				{
					"name": "Sleeping_Pill",
					"url": "https://sapi.com/foods/sleeping_pill"
				}
			],
			"tier_3_foods": [
				{
					"name": "Garlic",
					"url": "https://sapi.com/foods/garlic"
				},
				{
					"name": "Salad_Bowl",
					"url": "https://sapi.com/foods/salad_bowl"
				}
			],
			"tier_4_foods": [
				{
					"name": "Pear",
					"url": "https://sapi.com/foods/pear"
				},
				{
					"name": "Canned_Food",
					"url": "https://sapi.com/foods/canned_food"
				}
			],
			"tier_5_foods": [
				{
					"name": "Sushi",
					"url": "https://sapi.com/foods/sushi"
				},
				{
					"name": "Chocolate",
					"url": "https://sapi.com/foods/chocolate"
				},
				{
					"name": "Chili",
					"url": "https://sapi.com/foods/chili"
				}
			],
			"tier_6_foods": [
				{
					"name": "Pizza",
					"url": "https://sapi.com/foods/pizza"
				},
				{
					"name": "Steak",
					"url": "https://sapi.com/foods/steak"
				},
				{
					"name": "Mushroom",
					"url": "https://sapi.com/foods/mushroom"
				},
				{
					"name": "Melon",
					"url": "https://sapi.com/foods/melon"
				}
			]
		},
		"description": "The Turtle Pack is the first pack in Super Auto Pets and is immediately available to all players for free."
	},
	{
		"name": "Golden",
		"pets": {
			"tier_1_pets": [
				{
					"name": "Chipmunk",
					"url": "https://sapi.com/pets/chipmunk"
				},
				{
					"name": "Bulldog",
					"url": "https://sapi.com/pets/bulldog"
				},
				{
					"name": "Groundhog",
					"url": "https://sapi.com/pets/groundhog"
				},
				{
					"name": "Cone_Snail",
					"url": "https://sapi.com/pets/cone_snail"
				},
				{
					"name": "Goose",
					"url": "https://sapi.com/pets/goose"
				},
				{
					"name": "Pied_Tamarin",
					"url": "https://sapi.com/pets/pied_tamarin"
				},
				{
					"name": "Opossum",
					"url": "https://sapi.com/pets/opossum"
				},
				{
					"name": "Silkmoth",
					"url": "https://sapi.com/pets/silkmoth"
				},
				{
					"name": "Magpie",
					"url": "https://sapi.com/pets/magpie"
				}
			],
			"tier_2_pets": [
				{
					"name": "Hercules_Beetle",
					"url": "https://sapi.com/pets/hercules_beetle"
				},
				{
					"name": "Stoat",
					"url": "https://sapi.com/pets/stoat"
				},
				{
					"name": "Black_Necked_Stilt",
					"url": "https://sapi.com/pets/black_necked_stilt"
				},
				{
					"name": "Squid",
					"url": "https://sapi.com/pets/squid"
				},
				{
					"name": "Sea_Urchin",
					"url": "https://sapi.com/pets/sea_urchin"
				},
				{
					"name": "Door_Head_Ant",
					"url": "https://sapi.com/pets/door_head_ant"
				},
				{
					"name": "Lizard",
					"url": "https://sapi.com/pets/lizard"
				},
				{
					"name": "Sea_Turtle",
					"url": "https://sapi.com/pets/sea_turtle"
				},
				{
					"name": "Gazelle",
					"url": "https://sapi.com/pets/gazelle"
				},
				{
					"name": "African_Penguin",
					"url": "https://sapi.com/pets/african_penguin"
				}
			],
			"tier_3_pets": [
				{
					"name": "Musk_Ox",
					"url": "https://sapi.com/pets/musk_ox"
				},
				{
					"name": "Flea",
					"url": "https://sapi.com/pets/flea"
				},
				{
					"name": "Royal_Flycatcher",
					"url": "https://sapi.com/pets/royal_flycatcher"
				},
				{
					"name": "Surgeon_Fish",
					"url": "https://sapi.com/pets/surgeon_fish"
				},
				{
					"name": "Weasel",
					"url": "https://sapi.com/pets/weasel"
				},
				{
					"name": "Guineafowl",
					"url": "https://sapi.com/pets/guineafowl"
				},
				{
					"name": "Betta_Fish",
					"url": "https://sapi.com/pets/betta_fish"
				},
				{
					"name": "Meerkat",
					"url": "https://sapi.com/pets/meerkat"
				},
				{
					"name": "Flying_Fish",
					"url": "https://sapi.com/pets/flying_fish"
				},
				{
					"name": "Baboon",
					"url": "https://sapi.com/pets/baboon"
				},
				{
					"name": "Osprey",
					"url": "https://sapi.com/pets/osprey"
				}
			],
			"tier_4_pets": [
				{
					"name": "Manatee",
					"url": "https://sapi.com/pets/manatee"
				},
				{
					"name": "Cuttlefish",
					"url": "https://sapi.com/pets/cuttlefish"
				},
				{
					"name": "Egyptian_Vulture",
					"url": "https://sapi.com/pets/egyptian_vulture"
				},
				{
					"name": "Saiga_Antelope",
					"url": "https://sapi.com/pets/saiga_antelope"
				},
				{
					"name": "Sealion",
					"url": "https://sapi.com/pets/sealion"
				},
				{
					"name": "Vaquita",
					"url": "https://sapi.com/pets/vaquita"
				},
				{
					"name": "Slug",
					"url": "https://sapi.com/pets/slug"
				},
				{
					"name": "Poison_Dart_Frog",
					"url": "https://sapi.com/pets/poison_dart_frog"
				},
				{
					"name": "Secretary_Bird",
					"url": "https://sapi.com/pets/secretary_bird"
				},
				{